[
    {
        "id": "OD.1",
        "naziv": "Primer učilnice z akustičnim stropom",
        "vrsta": "ucilnica",
        "zasedenost": "polna",
        "prostornina": "8*6*3",
        "metoda": "en12354",
        "mejniElementi": [
            {"id": "stene", "naziv": "Ometane stene brez oken in vrat", "povrsina": "2*(8+6)*3-12-2", "alfa": 0.05},
            {"id": "strop", "naziv": "Strop", "povrsina": "8*6", "alfa": 0.05},
            {"id": "tla", "naziv": "Tla", "povrsina": "8*6", "alfa": 0.05},
            {"id": "okna", "naziv": "Okna", "povrsina": 12, "idAbsorpcije": "B.1.7"},
            {"id": "vrata", "naziv": "Vrata", "povrsina": 2, "idAbsorpcije": "B.1.8"}
        ],
        "povrsinskoPohistvo": [
            {"id": "stoli", "naziv": "Razporeditev stolov brez oseb", "povrsina": 20, "idAbsorpcije": "C.2.1", "prostornina": 1}
        ],
        "posamezniElementi": [
            {"id": "omara", "naziv": "Omara", "stevilo": 1, "absorpcijskaPovrsina": 0.5, "prostornina": 1.5},
            {"id": "ucenci", "naziv": "Učenci – dodatna absorpcija glede na prazne stole", "vrsta": "osebe", "stevilo": 24, "idAbsorpcije": "C.1.3"}
        ],
        "absorberji": [
            {"id": "stropnaObloga", "naziv": "Primer akustične stropne obloge", "idElementa": "strop", "povrsina": 30, "alfa": {"125": 0.3, "250": 0.6, "500": 0.8, "1000": 0.8, "2000": 0.8, "4000": 0.8}}
        ]
    }
]
